,Description,Link
45,"Data Specialist
. Vietnam
2 weeks ago Be among the first 25 applicants
Apply Now
Save
Direct message the job poster from .
Phượng Vũ
.
PI.EXCHANGE is a well-funded startup focused on the mission of democratising data science and providing AI & analytical services. Our vision is to create a platform where people, even without formal training in data science like IT managers, software engineers or business analysts can easily create, deploy and maintain their AI/ML applications on centralised or edge deployments. We aim to bring to our customers a quick and cost-efficient way to build smart applications and to supercharge their businesses with the power of Data Science, AI, and Analytics.

At PI.EXCHANGE, we are constantly pushing boundaries and challenging the status quo. We are doing it on a daily basis. We may be a small team but we have a huge ambition! Currently we are expanding and looking for awesome people to join us, from data scientists and software engineers to marketers and sales experts to join our team. If you are keen, we love to talk to you!



WHAT YOU WILL BE RESPONSIBLE FOR

You will be joining as a member of PI.EXCHANGE’s core Data Science team in the development of our flagship product: the PI.EXCHANGE AI & Analytics Engine, an AIaaS self-service smart automated Data Science platform providing a unified GPU-accelerated pipeline for data preparation, ML/DL model development and life-cycle management.

You will:

Primarily be a self-managing individual contributor. Research and develop new cutting-edge AI algorithms using techniques such as supervised/unsupervised ML, statistical/Bayesian inference etc. to power the AI & Analytics Engine with better, smarter, and more diverse recommendations for the end users;
Bring your novel ideas to a production-ready state by implementing them as modules, while adhering to industry standards in coding: quality, maintainability, and in conformance with the overall architecture are of paramount importance;
Participate in product-steering sessions in your technical capacity to:
Pitch new ideas to improve the product;
Respond to user feedback and business requirements by providing the necessary technical directions from a Data Scientist’s perspective, to put items on the product roadmap;
Participate in the delivery of our product to customers and other customer facing activities;
Participate in technical content writing. This may be in the form of product documentation, blog articles highlighting new features and use cases, as and when the need arises;
Understand and advocate our long-term vision while working with the management and product teams to define and adapt the same; and
Contribute to the evangelisation of our product and our culture internally and externally.

WHAT WE NEED FROM YOU

A self-starter with a strong passion for excellence. You always want to go above and beyond in everything you do;
An entrepreneurial “can-do” attitude and an innovative mindset;
Savvy and professional, ethical, and well developed interpersonal skills;
Preferably holding a Masters by Research, PhD or Postdoc in computer science (includes AI and Data Science), mathematics, physics, or engineering;
Sound in the mathematical foundations of ML/AI coupled with practical skills in these fields;
Good hands-on skills in statistical modeling and data analysis (pandas, Dask, Spark, etc.);
Experience with multiple ML/DL frameworks (scikit-learn, Dask, Spark Mllib/ML, XGBoost, LightGBM, TensorFlow, Torch, etc.). We expect you to know when and how best to employ them and understand various trade-offs.;
Understanding of performance issues such as scalability, complexity, and memory footprint of various algorithms;
Sound problem solving skills and algorithmic approach;
Expert understanding in at least one specialisation area within ML/AI:
Modern NLP/NLU using DL frameworks;
Scaling supervised and unsupervised ML algorithms to large data;
Bayesian Optimisation (for hyperparameter search and model selection);
PU Learning;
Active Learning;
Time-series analysis including classification, forecasting, and survival analysis;
GPU acceleration for ML/DL;
Explainable AI;
Applications of graphical models in AI such as Bayesian networks, Markov random fields, etc.
Demonstrated ability to write code that can run in production, in at least one of the following languages: Python, R, Scala, Julia, Java, C++, or Go.

WHAT WE OFFER

A competitive compensation package including opportunities for employee options awards (conditions applied);
Opportunities to enjoy meaningful and disruptive works on game-changing products;
A flexible, supportive and productive working environment;
Passionate colleagues and friends. You can find some interesting and like-minded folks here; and
A strong commitment to your personal and professional growth. You will be a better guru than you are today. And that is a promise!
Employment Type
Full-time
Show less
Employment type
Full-time
Turn on job alerts
Data Specialist in Vietnam
",https://vn.linkedin.com/jobs/view/data-specialist-at--2769476568?refId=m4CQcg6vuyREeeDwLUjrlA%3D%3D&trackingId=lGAMiDS6VSMfXN%2FDXKLA9Q%3D%3D&position=5&pageNum=2&trk=public_jobs_jserp-result_search-card
46,"Analytics Director
Robert Walters Ho Chi Minh City, Ho Chi Minh City, Vietnam
2 months ago Be among the first 25 applicants
See who Robert Walters has hired for this role
Apply on company website
Save
An Analytics Director job opportunity is now available at a fintech start-up. They are looking for a candidate with an insatiable curiosity to deeply understand user experiences and content consumption, and a passion to build a world-class, data driven product.

About The Analytics Director Role

You will be responsible for building up a proper data analytics structure and supporting them with a structured way to keep business being optimised.

Key Responsibilities
Work with the team to develop analytical dashboards to help other teams get better insights into the root causes of their business problems
Perform in-depth data analysis to work with strategy, product, UX team on user acquisition
Surface data insights via visualisation and dashboards as well as written and verbal communication
Work closely with designers, product and engineers to conduct A/B testing and iterate on better product improvements
Work with data engineering to design and crate data tables for analytical purposes
To succeed in this role, you must have strong written and verbal communication in English.

Key Requirements
Structured problem solving and analytical thinking
Experience with Python, R
Fundamental understanding on data infrastructure layers & machine learning
This organisation will offer you an excellent working environment with very good benefits.

If you are an enthusiast in enterprise analytics with a strong business mind-set and desire to work in a fast growing product company then this is a great opportunity for you.

Apply today to discuss this new opportunity.



Due to the high volume of applications we are experiencing, our team will only be in touch with you if your application is shortlisted.
Show less
Seniority level
Director
Employment type
Full-time
Job function
Research, Analyst, and Information Technology
Industries
Marketing and Advertising, Manufacturing, and Financial Services
Referrals increase your chances of interviewing at Robert Walters by 2x
See who you know
Turn on job alerts
Director Of Analytics in Ho Chi Minh City, Ho Chi Minh City, Vietnam
",https://vn.linkedin.com/jobs/view/analytics-director-at-robert-walters-2765939527?refId=m4CQcg6vuyREeeDwLUjrlA%3D%3D&trackingId=fAqwQ8wDWBTbqhTrTqrDKw%3D%3D&position=6&pageNum=2&trk=public_jobs_jserp-result_search-card
47,"Business Intelligence Executive
ShopeeFood Ho Chi Minh City, Ho Chi Minh City, Vietnam
1 month ago Be among the first 25 applicants
No longer accepting applications
MÔ TẢ CÔNG VIỆC Develop and automate report/ dashboard to monitor performance specified by management board, propose appropriate business key metrics at different developmental stages. Consult management and operational teams by running deep dive data analyses on issues/ ad-hoc requests that lead to actionable insights to growth the business. Be responsible for the accuracy of the data extraction. Support various business functions with the development and maintenance of various management reports. YÊU CẦU CÔNG VIỆC 0-2+ years of industry experience with proven business impact; degree in quantitative field preferred. Have experience with Power BI, data visualisation tools. Python, R (or other tools for statistical analysis) is a plus. Ability to manage multiple priorities and adjust quickly to changing priorities. Experience working with multiple stakeholders across various divisions. Ability to make inferences from data and devise appropriate course of actions. Excellence written and verbal communication skills in English and Vietnamese. Comfortable working with large data sets and numbers. Good working knowledge of the technology products. Self-starter with can-do attitude. Able to work in a team
Show less
Seniority level
Not Applicable
Employment type
Full-time
Job function
Information Technology
Industries
Consumer Services
Turn on job alerts
Business Executive in Ho Chi Minh City, Ho Chi Minh City, Vietnam
",https://vn.linkedin.com/jobs/view/business-intelligence-executive-at-shopeefood-2774955560?refId=m4CQcg6vuyREeeDwLUjrlA%3D%3D&trackingId=hILIht9nxhGS%2FdDLYIoMpw%3D%3D&position=7&pageNum=2&trk=public_jobs_jserp-result_search-card
48,"Risk Management Intern (Finance Department)
Intel Corporation Ho Chi Minh City, Ho Chi Minh City, Vietnam
4 weeks ago Be among the first 25 applicants
See who Intel Corporation has hired for this role
No longer accepting applications
Job Description

As a Finance Intern with major support for Risk Management, your responsibilities will include but not limit to:
Ethics Program:
Prepare Site communications via Newsletter, Intel Vietnam Messages, Controls Star, Controls Corners... to raise awareness of the Code of Conduct and related policies of Intel.
Give recommendations to improve Ethics Program and be pro-active to put the initiatives into practice.
ISO 37001 - Anti-bribery Management System Project/RBA/CW Sponsor Forum:
Prepare communications about project progress and key messages.
Provide logistics support where necessary.
Consolidate data/info for appropriate action taken.
Capital Compliance:
Support fixed asset physical audit.
Follow-up with Engineers on E-tag Process
Support reconciliation process for fixed asset
Risk Management/ Finance activities:
Perform data analytics (mostly in Excel) for audits, risk assessment, projects tracking, training tracking, etc.,
Actively engage with a variety of stakeholders and colleagues to facilitate projects under your scope and in Finance department.
Finance Interns will have opportunity to rotate to other departments including Finance Operations, Tax/Customs and Accounting.

Qualifications

To successfully complete your internship at Intel, candidate should possess below qualifications.

Minimum Qualifications

Candidate must be currently pursuing a Bachelor's degree in Finance, Economics or Accounting and completed your 3rd year.

Good communication skills, especially English, both verbally and writing.

Good capability of using the Microsoft ",https://vn.linkedin.com/jobs/view/risk-management-intern-finance-department-at-intel-corporation-2746642991?refId=m4CQcg6vuyREeeDwLUjrlA%3D%3D&trackingId=t5rsAVxc%2B1q%2Bynti8J4ZzQ%3D%3D&position=8&pageNum=2&trk=public_jobs_jserp-result_search-card
49,None,https://vn.linkedin.com/jobs/view/business-intelligence-specialist-ho-chi-minh-city-vietnam-at-wetv-sea-2773792986?refId=m4CQcg6vuyREeeDwLUjrlA%3D%3D&trackingId=pQgPu8NwNcFofH577K%2FQbA%3D%3D&position=11&pageNum=2&trk=public_jobs_jserp-result_search-card
50,"Senior Data Analyst (Level Expert)
HR1 Vietnam - Executive Search Firm Ho Chi Minh City, Vietnam
4 weeks ago Be among the first 25 applicants
See who HR1 Vietnam - Executive Search Firm has hired for this role
Apply Now
Save
Direct message the job poster from HR1 Vietnam - Executive Search Firm
Nhung Tran
Senior Recruitment Consultant at HR1 Vietnam - Executive Search Firm
SALARY: Upto 90 Mil (Negotiation)
Description
You will be our first data analyst and work directly with our Chief Data ",https://vn.linkedin.com/jobs/view/senior-data-analyst-level-expert-at-hr1-vietnam-executive-search-firm-2748407555?refId=m4CQcg6vuyREeeDwLUjrlA%3D%3D&trackingId=o8NHMdXwy69p%2FGiJ1wQk5A%3D%3D&position=12&pageNum=2&trk=public_jobs_jserp-result_search-card
51,"Senior Associate, Strategy & Planning
Lazada Ho Chi Minh City, Vietnam
2 weeks ago Be among the first 25 applicants
See who Lazada has hired for this role
Apply Now
Save
Understand business priorities and translate these into actionable project plans with defining clear scope & requirement, milestones and success criteria
Deliver accurate and insightful reporting to specified time schedules
Provide deep dive analysis support to Category Managers of Electronics
Liaise and build relationships with internal and external teams to ensure that effectiveness of the team, driven forward and business expectations are managed
Leverage internal/external data and reporting to analyses trends and provide input and recommendations to improve category performance metrics
Being responsible for any tasks assigned by supervisor

Job Requirements
Bachelor's/ Master's degree from a leading university
3+ years of data analysis/ research, project management role
Hands-on experience in project management and data analytics
Strong ownership and attention to detail
Ability to multi-task with strong time and project management skills
Microsoft office skills (PowerPoint, Excel) is a must
Strong problem-solving skills
Show less
Seniority level
Mid-Senior level
Employment type
Full-time
Job function
Strategy/Planning, Business Development, and Project Management
Industries
Market Research, Internet Publishing, and Computers and Electronics
Referrals increase your chances of interviewing at Lazada by 2x
See who you know
Turn on job alerts
Senior Strategy Associate in Ho Chi Minh City, Vietnam
",https://vn.linkedin.com/jobs/view/senior-associate-strategy-planning-at-lazada-2767087017?refId=m4CQcg6vuyREeeDwLUjrlA%3D%3D&trackingId=DMII6GNtG3sJbCJHLbW8qQ%3D%3D&position=13&pageNum=2&trk=public_jobs_jserp-result_search-card
52,"Potential Data Analyst Candidate
VEF Academy Ho Chi Minh City, Vietnam
4 weeks ago Be among the first 25 applicants
See who VEF Academy has hired for this role
Apply Now
Save
Direct message the job poster from VEF Academy
Huong Lam Phan
Marketing Collaborator at VEF Academy
[HOT OPPORTUNITY] THAM GIA HỆ SINH THÁI VEF ACADEMY – ƯƠM MẦM & PHÁT TRIỂN TÀI NĂNG CỦA BẠN TRONG LĨNH VỰC DỮ LIỆU

Với sứ mệnh tạo ra nguồn nhân lực chất lượng cao cho Việt Nam đáp ứng nhu cầu thị trường cạnh tranh toàn cầu, VEF Academy không ngừng mở rộng Cộng đồng các Ứng viên tiềm năng đang khát khao dấn thân vào lĩnh vực Data, AI nhiều thách thức. Dù bạn đã đi làm nhiều năm và muốn chuyển hướng sự nghiệp sang khối ngành Dữ liệu, hay đang là sinh viên với kế hoạch phát triển công việc trong lĩnh vực này, hoặc muốn học hỏi thêm để bổ sung kiến thức cho công việc hiện tại, thì thời điểm tốt nhất để bạn chuẩn bị đó là ngay-bây-giờ.
Hãy nắm lấy cơ hội đó chỉ với 1 click chuột – nhấn nút Easy Apply ngay bên trên và upload CV của bạn. Bạn sẽ nhận được hướng dẫn từ chúng tôi về cơ hội tham gia hệ sinh thái nghề nghiệp cùng với chương trình Mentoring có 1-0-2 tại VEF Academy.

Nếu những điều trên chưa đủ thuyết phục bạn chuẩn bị cho ước mơ của mình? Thì sau đây là 4 lý do bạn nên Apply CV ngay lúc này:
Cách thức đăng ký đơn giản, độc đáo. Thay vì phải điền đơn đăng ký, giờ đây, bạn chỉ cần gửi CV đến chúng tôi thông qua nút Easy Apply vô cùng tiện lợi.
Trong vòng 72 giờ, bạn sẽ nhận được tư vấn về lộ trình học tập, cũng như các bước cần chuẩn bị để bắt đầu sự nghiệp mơ ước, dựa trên CV và mục tiêu nghề nghiệp của bạn.
Có cơ hội trở thành thành viên chính thức của cộng đồng VEF Academy Students & Alumni, bạn có cơ hội tham gia vào hệ sinh thái nghề nghiệp của chúng tôi để gia tăng cơ hội tìm kiếm công việc và phát triển sự nghiệp. Bên cạnh đó, chương trình Mentoring sẽ đảm bảo bạn nhận được sự tư vấn, hỗ trợ tốt nhất trong quá trình ứng tuyển công việc. 
Điều tuyệt vời nhất chính là bạn sẽ có cơ hội mở rộng network của mình với các giảng viên, bạn học, các cựu học viên, các chuyên gia trong ngành cũng như các công ty đối tác của VEF Academy.  

“Đừng ngại nếu bạn không có hoặc có ít kinh nghiệm trong ngành Dữ liệu. VEF Academy ở đây để cùng bạn bắt đầu”

CHÂN DUNG ỨNG VIÊN TIỀM NĂNG CỦA HỆ SINH THÁI VEF ACADEMY
BẠN LÀ NGƯỜI...
Có niềm đam mê hay mong muốn phát triển sự nghiệp trong ngành Dữ liệu, hoặc mảng dữ liệu của các ngành riêng biệt 
Có tinh thần học hỏi, chủ động và kiên trì 
Chưa quen thuộc hoặc chưa thạo việc sử dụng các công cụ như Python, Power BI, SQL
Có tư duy về các con số và nhạy bén với sự thay đổi xu hướng 
Có nền tảng kinh tế, toán, tài chính, kế toán, marketing... là thế mạnh, nhưng không phải điều bắt buộc
Chủ động trong việc kết nối cùng giảng viên, mentor và các (cựu) học viên VEF Academy để mở rộng network cũng như cơ hội nghề nghiệp

BẠN SẼ...
Tham gia hệ sinh thái VEF Academy và cộng đồng VEF Academy Students & Alumni, mở rộng network và cơ hội nghề nghiệp, học bổng hấp dẫn
Cập nhật sớm thông tin cơ hội nghề nghiệp, các sự kiện, webinar... từ các công ty đối tác của VEF Academy 
Tham gia các khóa học Data Analytics/ Data Science chất lượng được hướng dẫn bởi các giảng viên nhiều năm kinh nghiệm với mức học phí hợp lý & nhiều ưu đãi
Cơ hội hình thành các project cá nhân cuối khóa học - minh chứng cho kết quả học tập và tạo uy tín cho portfolio/ CV của bạn
Cơ hội tham gia chương trình Mentoring để được hỗ trợ, tư vấn trước khi tham gia vòng test Technical Skills của các công ty đối tác của VEF Academy
Tham gia vào môi trường học tập tích cực và chủ động: tích cực tìm tòi kiến thức để trao đổi với giảng viên, học viên khác; chủ động chia sẻ kiến thức, cơ hội công việc, học bổng với tinh thần Pay-It-Forward
Được giới thiệu, chia sẻ các tài liệu bổ ích và kinh nghiệm làm việc quý báu của các Giảng viên, cựu học viên 

BẠN CHƯA BIẾT BẮT ĐẦU TỪ ĐÂU...
NHƯNG BẠN ĐÃ SẴN SÀNG DẤN THÂN CHO HÀNH TRÌNH PHÁT TRIỂN SỰ NGHIỆP CỦA MÌNH?
Vậy thì hãy nắm lấy cơ hội trở thành một nhân tố tài năng trong cộng đồng VEF Academy và chủ động tạo ra giá trị cho tương lai của chính bạn chỉ bằng việc Apply CV ngay lúc này!
“Đừng quên, VEF Academy ở đây để cùng bạn bắt đầu”
Cơ hội tham gia hệ sinh thái VEF Academy có hiệu lực kể từ ngày 13-10-2021 cho đến khi chúng tôi thông báo kết thúc. Ở thời điểm hiện tại, chương trình được áp dụng cho ứng viên đăng ký qua kênh LinkedIn & thông qua hình thức apply CV.
Mọi thắc mắc về chương trình, bạn có thể gửi về địa chỉ email của VEF Academy: vefacademymarketing@gmail.com 

ABOUT US
VEF Academy là một tổ chức giáo dục phi lợi nhuận được thành lập bởi các cựu sinh viên của chương trình VEF (www.vef.gov) và được hỗ trợ bởi ĐSQ Hoa Kỳ với sứ mệnh xây dựng thế hệ tài năng công nghệ người Việt tầm vóc thế giới.

Với sứ mệnh tạo ra nguồn nhân lực chất lượng cao cho Việt Nam đáp ứng nhu cầu thị trường cạnh tranh toàn cầu, kể từ ngày thành lập, VEF Academy tới nay cung cấp các khoá đào tạo trong ngành AI, Data: Machine Learning, Data Analytics, Business Intelligence, Fundamentals of Data Analytics, Fundamentals of Machine Learning, etc và ngày càng nhận được nhiều sự tin tưởng từ các công ty đối tác trong vai trò phát triển và kết nối nguồn nhân lực tài năng.

Facebook Fan Page: www.facebook.com/vefacademy
Show less
Employment type
Part-time
Referrals increase your chances of interviewing at VEF Academy by 2x
See who you know
Turn on job alerts
Data Analyst in Ho Chi Minh City, Vietnam
",https://vn.linkedin.com/jobs/view/potential-data-analyst-candidate-at-vef-academy-2733246562?refId=m4CQcg6vuyREeeDwLUjrlA%3D%3D&trackingId=UfZxwwSsL8tbQDKaRH7Nnw%3D%3D&position=14&pageNum=2&trk=public_jobs_jserp-result_search-card
53,"Junior Business Consultant
Sonum International Ho Chi Minh City, Vietnam
2 weeks ago Be among the first 25 applicants
See who Sonum International has hired for this role
Apply on company website
Save
Direct message the job poster from Sonum International
Krzysztof Woszczyk
About you 
To be able to grow into the role of Junior Business Consultant we think the following characteristics are important: 
Willingness and ability to learn and an entrepreneurial mindset, 
Bachelor’s degree in Finance, Economics, Information Management and Technology, Engineering, or related field, 
Familiarity with financial/multi-dimensional modelling, data analytics, or business intelligence concepts, 
Dare to work autonomously, take decisions and responsibility, 
Demonstrated analytical and problem‐solving skills, 
Love numbers, solving mathematical puzzles and finding cause-effect relationships, 
Effective oral, written, and interpersonal communication skill, 
Good level of English, additional languages are an advantage, 
Strong Microsoft Excel abilities, 
Willingness to travel. 

Responsibilities of the Consultant include: 
Demonstrate technical knowledge for software implementations including activities around field-to-field data mapping, conversion validation, system and security configuration, user acceptance testing, and system integration testing, 
Assist user requirements analysis; facilitate business process design sessions, identify gaps, issues, and reporting risk areas as part of an implementation team, 
Maintain client focus and demonstrate ownership to drive consensus and project related decisions, 
Work in a collaborative way with other team members and clients to deliver successful and sustainable solutions, 
Communicate well written and orally at all levels‐managerial, technical, and user, 
Understand priorities, scope, timeline, goals, and key milestones. 
 About Keyrus & Sonum International 
Sonum International and Keyrus offer consulting and implementation services in the areas of Data, Digital, Management & Transformation, and Enterprise Performance Management. 
Combined, we have 3,300+ resources with offices in over 25 countries. We dare to say that we are truly international, supporting organizations around the globe with a team of many different nationalities speaking 20+ languages. 
Our consultants combine financial, business and IT expertise and aim to be the best of class, they are completely focused on adding value for our customers. 
We do not believe in corporate structures; we do believe in people who take responsibility and want to build a team based on trust.  
   Show less
Employment type
Full-time
Referrals increase your chances of interviewing at Sonum International by 2x
See who you know
Turn on job alerts
Junior Business Consultant in Ho Chi Minh City, Vietnam
",https://vn.linkedin.com/jobs/view/junior-business-consultant-at-sonum-international-2775579078?refId=m4CQcg6vuyREeeDwLUjrlA%3D%3D&trackingId=eO7WlZZFL6DS7yfB3GoTuQ%3D%3D&position=15&pageNum=2&trk=public_jobs_jserp-result_search-card
