,Description,Link
135,"Data Modeler
Discova Ho Chi Minh City, Ho Chi Minh City, Vietnam
2 weeks ago Be among the first 25 applicants
See who Discova has hired for this role
No longer accepting applications
Direct message the job poster from Discova
Duy Nguyen Ngoc
Head of Global Commercial Modelling and Reporting at Discova
Power BI Developer/Data Modeler

Are you passionate about the integrity of numbers?
Do you thrive in the ability to assess the financial health of a multinational business?
Are you passionate about responsible travel and want to make a difference through your work?
Then we want to hear from you!

About Us
The Discova brand was launched in July 2019 and is the newest brand in the Flight Centre Travel Group family of brands. The merger of Buffalo Tours in Asia and Olympus Tours in the Americas created a global DMC business with more than 20 years experience in delivering amazing travel experiences to our customers. With a purpose to connect people and places with a world of possibilities, we are the travel people who work globally, live locally and go the extra mile to help our partners extend their reach.

About the Opportunity
Discova is looking for a Power BI Developer/Data Modeler to join the team in Ho Chi Minh City, Vietnam. In this business-critical role, you will be using the latest methodologies and tech in the BI space and participate in the enhancement of a global BI solution. Using Power BI you will be developing and designing Business Intelligence reporting based on data delivered through Hive tables and databases. You will be well versed in SQL, experienced in scoping/designing data marts for BI consumption preferably with Power BI shared datasets, and assisting with other ad-hoc reporting. A high level of experience in transforming business requirements into reusable tabular data models is essential for success in this role. Experience as a dedicated data modeler would be highly regarded.

Key Responsibilities:

Implementation of BI dashboards while ensuring the solution meets flexibility, usability, and performance requirements
Assisting with the creation and maintenance of SQL store procedures, views, and ad-hoc SQL reporting, including directly querying delta lake through HIVE and Databricks notebooks
Work cross-functionally with Technology, Operations, Products, and Finance to deliver strategic projects allowing the company to offer the best customer experience.
Data protection
Follow and take a leading role in Global BI's established policies and procedures for solution development lifecycle, including analysis, design, testing,
Tourplan system enhancements for further automation e.g. auto uploads of cash receipts and payments, auto reconciliations, fine-tuning of month-end processes.
Power BI and integration with Tourplan system and other sources of data to provide better information for leaders.
Maintain and support data analytics platforms
Integration of Tourplan system back end to other 3rd party distribution and reservation systems to ensure transactions are recorded correctly and efficiently eg. Bokun, Live, Travelbox (new Calypso).
Work closely with selling business teams to understand information requirements to ensure solutions align with business needs
Identify areas of inefficiency in the existing system/ manual processes, and help users to define business requirements that may entail process streamlining and/or automation. Assist users and provide guidance in process mapping for as-is and to-be process modeling.
Create an environment where people feel supported, connected, and empowered.
Ensure that what is meant to happen in the business does happen.
Build trust and strong working relationships with business teams to ensure that Discovers finance operations are executed in line with the prescribed SLAs.
About you:
The Essentials:

1 - 2 years' Data Analysis experience or similar
Experience with PowerBI, SQL (Google BigQuery, AWS, MongoDB)
Strong Microsoft Applications capability, particularly with Excel and data manipulation
Strong attention to detail and ability to identify trends within data sets
Financial knowledge is additional.
Fluent in written and verbal in both Vietnamese language and English.

The Attributes:

Proven problem-solving skills.
Customer-centric with a commitment to high standards of service delivery.
High attention to detail & strong time/priority management skills
Effective time/priority management skills.
Strong interpersonal and presentation skills across different cultures.
A flexible rotating roster that may include late nights, weekends, and early mornings and flexible with uncertainties/changing priorities and under pressure.
Ability to travel on business when required
Finally, if you are successful, you will find out that working with Discova is more than just a job. To be part of the Discova family is to be in your element. We offer an exciting career progression globally and a fantastic and supportive team culture and social events that are the envy of the industry.


Get in touch now and Discova a world of possibilities!
Show less
Employment type
Full-time
Referrals increase your chances of interviewing at Discova by 2x
See who you know
Turn on job alerts
Data Modeler in Ho Chi Minh City, Ho Chi Minh City, Vietnam
",https://vn.linkedin.com/jobs/view/data-modeler-at-discova-2768802503?refId=cDiPiTm6lRP5N5fbA8ayLA%3D%3D&trackingId=eyB12hxmLPBWryJ3mbACFg%3D%3D&position=4&pageNum=4&trk=public_jobs_jserp-result_search-card
136,"Researcher
Gojek Ho Chi Minh City, Ho Chi Minh City, Vietnam
2 weeks ago Be among the first 25 applicants
See who Gojek has hired for this role
Apply on company website
Save
About The Role

If you are passionate about creating real business impact with the power of insights, you are in for a treat! As our Researcher in the Research & Insights team in Gojek Vietnam, you’ll be the go-to person for market insights, and the voice of our users and driver partners, helping to solve a multitude of business problems. Your main objective is to ensure that good insights get to the right audience, are interpreted the intended way, and are maximizing return on investments for the business. On this ride with us, you can expect the folks from Marketing, Corporate Strategy, Operations, Product Development teams to be your companions on a daily basis. You’ll get ample opportunity to hone your craft in qualitative, quantitative, and analytical research by managing multiple research projects end-to-end.

What You Will Do

Design effective research studies (small to medium scale) with appropriate methodologies to meet the objectives within agreed upon timeline
Embed yourself in various teams by attending/initiating relevant meetings and understand their research questions
Manage and execute research projects from end-to-end (e.g. Data Analysis, U&A study, Opportunity Sizing Study, Pricing Study, Conjoint Study, Competitive Analysis)
Generate actionable insights and recommendations, followed by democratising the findings through presentations, discussions, or even workshops
Discover and discuss research ideas, new methodologies, best practices with your manager to bring the Research & Insights team to greater heights

What You Will Need

At least 2 years of experience in market research and consulting with proficiency in qualitative and quantitative methodologies and processes
Experience in consumer insights, and/or B2B research
Ability to see beyond the obvious to derive deep actionable insights from robust analysis
Good problem solving skills and being resourceful in overcoming challenges
Experience in project management, able to exercise judgement to prioritize and execute on research needs
Detail oriented, with ability to work under pressure while maintaining high output quality
Proficiency in Vietnamese and English (written & oral)ª
About The Team

The Research & Insights team is a family of 90 researchers spread out across Jakarta, Singapore, and Ho Chi Minh. Together with stakeholders in the Product, Business strategy, Operations and Marketing teams, we work to enhance the development and execution of Gojek’s overall business and marketing strategies, product design, and communication methods on various channels. Specifically, our approach combines sharp technical research skills, deep domain expertise on tech products, and well-worn analytical thinking abilities. As a multidisciplinary team, we strive to deliver insights and recommendations by ways of merging qualitative, quantitative, analytical, and business research.

One of the biggest hurdles our team has had to face in the past is how to optimize the impact of our insights. It took us a lot of collaboration, brainstorming, and experimentation to figure out the best way to tackle this obstacle. Eventually, we learned that having more direct communication on our expectations, packaging and framing our insights that fit with different types of stakeholders, and really listening to what our company needs were the key to overcoming this barrier. Currently, we’re busy at work on various projects, including one about how to optimize our offerings and service for our merchant-partners. When we aren’t busy with our heads deep in research, you’d probably find us playing games together through Zoom. We’re made up of cinema enthusiasts, karaoke lovers, and anime fanatics. When COVID eventually subsides, our team is excited to have meals together once again.

About Us

Gojek is a Super App. It’s one app for ordering food, commuting, digital payments, shopping, hyper-local delivery, and dozen other products. It is Indonesia’s first and only decacorn. It's also the only Southeast Asian startup to be part of Fortune's list of 'Companies That Changed The World.'

Our Mission: To create and scale positive socio-economic impact for our customers, driver-partners, business and MSMEs.

As of 2021, Gojek processed more than $9 billion annualised gross transaction value across all markets where it operates - in Singapore, Thailand, Vietnam and Indonesia. We have the largest food delivery product in Asia, (outside of China), and the largest payments wallet in Southeast Asia.

Our investors include Google, Facebook, PayPal, Sequoia Capital, Tencent Holdings among others.

Gojek is committed to building a diverse and inclusive workplace and is an equal opportunity employer. We do not discriminate on the basis of race, religion, national origin, gender, gender identity, sexual orientation, disability, age, education status, or any other legally protected status.
Show less
Seniority level
Associate
Employment type
Full-time
Job function
Research, Analyst, and Information Technology
Industries
Computer Software, Internet Publishing, and Financial Services
Referrals increase your chances of interviewing at Gojek by 2x
See who you know
Turn on job alerts
Researcher in Ho Chi Minh City, Ho Chi Minh City, Vietnam
",https://vn.linkedin.com/jobs/view/researcher-at-gojek-2714545815?refId=cDiPiTm6lRP5N5fbA8ayLA%3D%3D&trackingId=F7CeVSNWCLzoz%2BvPZ7%2Ftkw%3D%3D&position=5&pageNum=4&trk=public_jobs_jserp-result_search-card
137,None,https://vn.linkedin.com/jobs/view/consulting-internship-program-vn-at-deloitte-2770484618?refId=cDiPiTm6lRP5N5fbA8ayLA%3D%3D&trackingId=n7s5oTu8aVGj6mbGbqsSdw%3D%3D&position=6&pageNum=4&trk=public_jobs_jserp-result_search-card
138,"Consultant / Senior Consultant - Artificial Intelligence & Data - VN
Deloitte Hanoi, Hanoi, Vietnam
2 weeks ago Be among the first 25 applicants
See who Deloitte has hired for this role
Apply on company website
Save
At Deloitte, we offer a unique and exceptional career experience to inspire and empower talents like you to make an impact that matters for our clients, people and community. Deloitte offers you a highly inclusive, collaborative workplace and unrivalled opportunities to realize your full potential. We are always looking for people with the relentless energy to push themselves further, and to find new avenues and unique ways to reach our shared goals.

Work you will do

This role sits within the Artificial Intelligence & Data team of Deloitte Southeast Asia, which encompasses data, analytics and cognitive automation (CA). As a leader of this group, you will drive the growth of our CA business in the region and be responsible for the creation, sale and delivery of CA solutions: robotic process automation, intelligent character recognition, chatbots/virtual assistants and artificial intelligence.

The Artificial Intelligence & Data team leverages the power of data, analytics, robotics, science and cognitive technologies to uncover hidden relationships from vast troves of data, generate insights, and inform decision-making. Together with the Strategy practice, our Strategy & Analytics portfolio helps clients transform their business by architecting organizational intelligence programs and differentiated strategies to win in their chosen markets.
Apply emerging technologies to help our clients maximize the value of their data by generating actionable insights that provide real business outcomes.
Designing and implementing data structures to support Big Data, Analytical models and traditional BI/DW reporting solutions using technologies such as Microsoft SQL, Oracle, SAP, Cloudera, IBM Watsons, MuleSoft, Qlik Technologies or Informatica.
Designing and developing data integration using Data Governance, Data Quality, MDM and Metadata management.
Applying analytical models to predict business outcomes with tools such as DataRobot and languages like Python or R.
You will be part of a collaborative team that provides our clients with solutions that are practical as well as visionary and have an impact from the back office to the boardroom.
Demonstrated experience across a broad range of industries such as Energy and Resources, Public Sector, Financial Services, Life Sciences and Health Care, Consumer Business, Manufacturing, Telecommunications or Consumer Business.
Ability to link industry specific business requirements to BI, Analytics and Big Data solutions.
Ability to recommend BI/DW/Analytics processes, governance, organisational and platform models, tool selections, and data integration options to clients.
Project experience through all phases of the project lifecycle from strategy and advisory, scoping and planning, requirements gathering, design, development, testing, training and deployment.
Enough About Us, Let's Talk About You

If you are someone with:
A good honors Degree, preferably at postgraduate level, in Computer Science, Software Engineering, Statistics, Mathematics or related disciplines.
Experience in Big 4 or MNC Consulting firm or industry equivalent role.
Minimum 4 years (Consultant) or 6 years (Senior Consultant) of relevant experience.
Strong experience in one or more of the following programming languages: Scala, Python, or R.
Experience with one or more non-relational data stores such as Pivotal, Cloudera, Hortonworks, MapR, Oracle BDA.
Experience with one or more relational data stores using SQL, Oracle DB, Microsoft SQL Server, IBM Netezza, Teradata or MySQL.
Experience building data ingestion and transformation pipelines using Big Data technologies, including one or more of the following: Spark, Hive, Pig, Kafka, MapReduce, HBase, Sqoop, Flume or Storm.
Experience working with Agile software engineering tools and applying Agile methodologies in a pragmatic manner.
Experience working with Source Control Management tools such as Git, Subversion or Mercurial.
General knowledge of Linux/Unix based operating systems and Shell scripting.
Experience directly interfacing with business and IT stakeholders for clients.
Excellent problem solving skills, ability to think out-of-the-box, work under pressure and tight project timelines.
Drive, tenacity, client focused and results oriented.
Excellent communication and presentation skills in English.
In addition to strong client service orientation, we are also seeking talented leaders who have the capability to deliver quality solutions with superior analytical and problem solving skills. Besides excellent interpersonal and communication skills, candidates should have proven demonstration of sound business acumen, teamwork and leadership qualities. An appreciation of the consulting lifestyle and ability to travel is a pre-requisite.

Next Steps

So what are you waiting for? Join the winning team now.

Due to volume of applications, we regret only shortlisted candidates will be notified.

Requisition ID: 58975

In Vietnam, the services are provided by Deloitte Vietnam Company Limited and other related entities in Vietnam (""Deloitte in Vietnam""), which are affiliates of Deloitte Southeast Asia Ltd. Deloitte Southeast Asia Ltd is a member firm of Deloitte Touche Tohmatsu Limited. Deloitte in Vietnam, which is within the Deloitte Network, is the entity that is providing this Website.
Show less
Seniority level
Associate
Employment type
Full-time
Job function
Consulting, Information Technology, and Sales
Industries
IT Services and IT Consulting, Computer Software, and Management Consulting
Referrals increase your chances of interviewing at Deloitte by 2x
See who you know
Turn on job alerts
Senior Consultant in Hanoi, Hanoi, Vietnam
",https://vn.linkedin.com/jobs/view/consultant-senior-consultant-artificial-intelligence-data-vn-at-deloitte-2710369737?refId=cDiPiTm6lRP5N5fbA8ayLA%3D%3D&trackingId=eUOkUegSSRAPhyHNAhdoOA%3D%3D&position=7&pageNum=4&trk=public_jobs_jserp-result_search-card
139,"Chuyên Viên Phân Tích Kinh Doanh
Shopee Ho Chi Minh City, Ho Chi Minh City, Vietnam
2 months ago Be among the first 25 applicants
No longer accepting applications
Bộ phận Vận hành ứng dụng đóng vai trò trọng tâm là cầu nối giữa các lập trình viên, phòng kinh doanh và bộ phận thiết kế sáng tạo tại Shopee. Họ chịu trách nhiệm trong việc thực hiện chiến lược và vạch ra lộ trình để đạt được mục tiêu kinh doanh. Bộ phận này hỗ trợ cho mọi phòng ban khác tại Shopee bao gồm Thanh toán, Chuỗi cung ứng, Marketing, Listings, Trải nghiệm người dùng (User Acquisition), Tìm kiếm và đề xuất, Xử lý gian lận, v.v..Hãy gia nhập Shopee để có cơ hội làm việc với ứng dụng có tầm ảnh hưởng đển hàng triệu người dùng trên toàn bộ khu vực Đông Nam Á và Đài Loan. Job Description: Implement product research, market research, competitive analysis to appraise new product features to enhance the experience of affiliate partners and competitiveness of the program. Analyze team working flow and requests from internal users to develop product requirements to increase work efficiency. Collaborate closely with local and regional Product team in preparing detailed requirement documents, prototype construction, managing timeline to ensure delivering of the product / solution. Provide training material and support for external and internal users during operation. Support other cross-functional team in topics relating to affiliate product. Support manual testing (if needed). Requirements: At least 1 year of experience in Business Analysis or Product Development. Good communication skills across teams/organizations. Sharp analytical and problem-solving skills. Experience in SQL and Scripting Language. MySQL and Python are preferred. Understanding of data and database design, implementation, troubleshooting and maintenance. Good time-management skills. Experience in E-commerce or Digital marketing is a plus.
Show less
Seniority level
Associate
Employment type
Full-time
Job function
Other
Industries
IT Services and IT Consulting, Internet Publishing, and Manufacturing
Turn on job alerts
Chuyên Viên Phân Tích Kinh Doanh in Ho Chi Minh City, Ho Chi Minh City, Vietnam
",https://vn.linkedin.com/jobs/view/chuy%C3%AAn-vi%C3%AAn-ph%C3%A2n-t%C3%ADch-kinh-doanh-at-shopee-2762689293?refId=cDiPiTm6lRP5N5fbA8ayLA%3D%3D&trackingId=eOxFaAj4z6cPqGgRU4NLBw%3D%3D&position=10&pageNum=4&trk=public_jobs_jserp-result_search-card
140,"Operations - Project Management
Shopee Ho Chi Minh City, Ho Chi Minh City, Vietnam
1 week ago Be among the first 25 applicants
See who Shopee has hired for this role
Apply on company website
Save
Job Description
Assist with data analysis of seller communication channel performance, including online traffic, awareness, engagement, conversion rates, etc.
Evaluate business metrics, deliver effective presentations of findings and recommendations (through dashboard, reports), create a visual display of quantitative information
Effectively communicate solutions and analysis results to channel owners to improve future marketing strategies
Work with functional stakeholders to lead and drive projects that enhance seller communication efficiency and internal working process
Assist team leader in other tasks assigned

Requirements
Experienced in data analysis, data visualization
Proficient in Excel & Powerpoint
Experienced in project coordination and problem-solving
Good communication (written and verbal communication) skill, positive attitude and willingness to learn
Have knowledge/ experience in social communication and e-commerce industry is a plus
Attention to details, logical and data-driven
Show less
Seniority level
Associate
Employment type
Full-time
Job function
Project Management and Information Technology
Industries
Internet Publishing
Referrals increase your chances of interviewing at Shopee by 2x
See who you know
Turn on job alerts
Project Management Specialist in Ho Chi Minh City, Ho Chi Minh City, Vietnam
",https://vn.linkedin.com/jobs/view/operations-project-management-at-shopee-2698740224?refId=cDiPiTm6lRP5N5fbA8ayLA%3D%3D&trackingId=i1KhY3Rvm15p1ARobWn%2FIw%3D%3D&position=11&pageNum=4&trk=public_jobs_jserp-result_search-card
141,"Consulting Analyst - VN
Deloitte Ho Chi Minh City, Ho Chi Minh City, Vietnam
3 weeks ago 48 applicants
See who Deloitte has hired for this role
Apply on company website
Save
At Deloitte, we offer a unique and exceptional career experience to inspire and empower talents like you to make an impact that matters for our clientsDate: 06-Nov-2021

Type of Employment: Fixed Term Employment Contract Full Time

City: Ho Chi Minh City

At Deloitte, we offer a unique and exceptional career experience to inspire and empower talent like you to make an impact that matters for our clients, people and community. Deloitte offers you a highly inclusive, collaborative workplace and unrivalled opportunities to realize your full potential. We are always looking for people with the relentless energy to push themselves further, and to find new avenues and unique ways to reach our shared goals.

Work you will do

You will be part of our graduate program, working alongside with some of the best and brightest people anywhere, on behalf of many of the world’s most influential companies. You will be at the center of it all, performing primary and secondary research, data analysis and modelling to tackle complex business problems. In addition, you will contribute directly to the development of proposals, presentations and publications.

This program will allow you to develop core consulting skills and business acumen whilst gaining access to a wide scope of training and development activities. In addition, you will have an opportunity to work with like-minded people and gain exposure to a variety of projects within the chosen business area.

There are opportunities available across several our 5 portfolio offerings, alignment to specific offerings will be determined based on skill capabilities and relevant experience.
Strategy, Growth and Innovation
Core Business Operations
Customer & Marketing
Human Capital
Enterprise, Technology & Performance
Enough About Us, Let's Talk About You
Strong academic performance
Open to fresh graduates with no more than 2 years of working experience
Team player with effective interpersonal and communication skills
Demonstrated leadership and teamwork within or outside a work setting.
Exceptional problem-solving ability. Logical reasoning, creative thinking, comfort with numbers, and the ability to untangle complex issues.
Strong passion for consulting, ability to adapt and cope in a fast pace, challenging work hours and environment
Fluent verbal and written English
Willingness to work outside of the office base and most of all…
A sense of humour!
Next Steps

So what are you waiting for? Join the winning team now.

Due to the high volume of applications, we regret only shortlisted candidates will be notified.

Requisition ID: 58955

In Vietnam, the services are provided by Deloitte Vietnam Company Limited and other related entities in Vietnam (""Deloitte in Vietnam""), which are affiliates of Deloitte Southeast Asia Ltd. Deloitte Southeast Asia Ltd is a member firm of Deloitte Touche Tohmatsu Limited. Deloitte in Vietnam, which is within the Deloitte Network, is the entity that is providing this Website.
Show less
Seniority level
Associate
Employment type
Full-time
Job function
Business Development and Sales
Industries
IT Services and IT Consulting, Computer Software, and Management Consulting
Referrals increase your chances of interviewing at Deloitte by 2x
See who you know
Turn on job alerts
Consulting Analyst in Ho Chi Minh City, Ho Chi Minh City, Vietnam
",https://vn.linkedin.com/jobs/view/consulting-analyst-vn-at-deloitte-2708687683?refId=cDiPiTm6lRP5N5fbA8ayLA%3D%3D&trackingId=vaxNJhbvd7yi2VqnBAyKaw%3D%3D&position=12&pageNum=4&trk=public_jobs_jserp-result_search-card
