,Description,Link
60,"About the job
Responsibilities:

A.     Analyst data detail for Agency Channels and Non-bank Channel
·        Be responsible for collection, analysist detail performance, structure KPI/ key point from sales force
·        Build and manage sales monthly dashboard, sales performance data analysis and reports include tracking performance weekly, daily to Manager/CDO to push sales.
·        Be responsible to build and maintain data master/hub out of system/ data mapping to provide full picture sales force to manager
·        Provide adhoc report related to DA and Non-Bank

B.     Build and develop, management of sales tool system for DA, Non-Bank
·        Work with related department to support management in BA requirement related to sales support system: Zalo OA, DDH, BES…
·        Design training document/ communicate/ guild sales force about all sales support application or tool for DA/non-Bank

C. Support build compensation, contest, incentive scheme for DA and non-bank
Support Manager to analyst/build and update/monitor about compensation, incentive scheme for DA and Non-bank.

Requirements:
·        At least 2 years working experience in Planning, Sales analytics
·        Able to work independently under high pressure and have team working spirit
·        Problem solving, general knowledge of sales operation and support
·        Microsoft ",https://vn.linkedin.com/jobs/view/agency-data-analysis-reporting-assistant-manager-at-bidv-metlife-2748000559?refId=7ygMmKb6vAOSeRlvf5g7vg%3D%3D&trackingId=3%2FF%2BZ%2F7GwHzaK5QoEW9zZQ%3D%3D&position=3&pageNum=3&trk=public_jobs_jserp-result_search-card
61,"About the job
Traveloka is a Southeast Asian tech unicorn with core businesses in travel and financial services. Currently we are rapidly expanding in the region. ",https://vn.linkedin.com/jobs/view/data-analyst-pay-later-vietnam-at-traveloka-2756468900?refId=7ygMmKb6vAOSeRlvf5g7vg%3D%3D&trackingId=tLs%2FlTWgCi0QwK0jfyWnTw%3D%3D&position=5&pageNum=3&trk=public_jobs_jserp-result_search-card
62,"About the job
This job is sourced from a job board. Learn more
Business Requirements & Analysis:
Evaluates internal and external customers’ needs and abilities in order to provide appropriate solutions.
Provides input to business requirements for the design of solutions
Identifies and provides input to new technology opportunities that will have an impact on the enterprisewide BI systems
Advises executives on how BI (processes, practices and technologies) play a critical role in improving business management and optimization
Explores the data and discovers patterns, meaningful relationships, anomalies and trends.
Designs Group-wide “views” and custom reports
May perform analysis for a wide range of requests using data in different formats and from various platforms
Researches business problems and creates models that help analyze these business problems.
Develops best practices for report deployments
Research, Project/Work Planning:
Researches best practices
Suggest selection of tools, frameworks and mechanisms for data analytics
Aligns BI technologies with strategic initiatives
Stays abreast of BI products/tools and of business strategies and direction
Participates in workstream planning process including inception, technical design, development, testing and delivery of BI solutions
Develops work plans or reviews other work plan timelines and manages workflows to meet timeframes.
Participates in project management estimation process
Manages and plans for service demand forecasts
Conducts analyses of functional business processes and functional requirements and participates in the development of business cases in the support of process changes and/or IT projects
Testing and Information Quality Assurance:
Leads or provides direction for the planning, designing, and execution of user testing efforts
Oversees the implementation (i.e., testing, issues resolution) of new systems or modifications
Analyzes testing results to ensure the solution meets the needs of the business
Provides support to test teams
Recommends quality metrics and ensures quality metrics are documented and tracked
Creates data quality tickets, as needed
Policies, Procedures, and Training:
Adheres to current standards
Recommends standards, policies and procedures for the form, structure, and attributes of the BI tools and systems
Designs and delivers end-user training and training materials
Trains users, including executives, to transform data into actionoriented information and to use that information correctly",https://vn.linkedin.com/jobs/view/business-intelligence-analyst-at-datvietvac-group-holdings-2751003789?refId=7ygMmKb6vAOSeRlvf5g7vg%3D%3D&trackingId=dvfEQha1CO57Mt1hsBQXDA%3D%3D&position=6&pageNum=3&trk=public_jobs_jserp-result_search-card
63,"About the job
Note: just opens for vietnamese or expats who are currently living in Vietnam now
",https://vn.linkedin.com/jobs/view/remote-data-engineer-at-confidential-2774515969?refId=7ygMmKb6vAOSeRlvf5g7vg%3D%3D&trackingId=aAjzitKHr%2BQpq3jdsF5oBA%3D%3D&position=7&pageNum=3&trk=public_jobs_jserp-result_search-card
64,"About the job
Job Description:

Job Summary:

Work with PnL owners and other functions in formulating strategy and key initiatives to grow Grab products and services in Vietnam. You will dive deep to understand the merchant, driver partners and consumer sides of the business and provide recommendations to improve key metrics of the organization and build long term direction going forward.

The day-to-day activities:
Develop frameworks to analyze business problems, develop hypotheses, mine data, deliver recommendations, and assess impact of proposed solutions
Perform analysis & research plans to support decision making process
Able to partner closely with all business stakeholders across different functions to set and implement strategy
Manage end-to-end data projects; identifying issues, gathering information from various sources, analyzing data, interpreting patterns, and trends with the purpose of generating insights about the market
Conduct industry analysis and research with respect to competitive market trends to drive business insights.
Key requirements:
Bachelor’s or advanced degree in a relevant field.
Fluent in written and spoken English
At least 8 years of experience working in Management Consulting / Operations Management/ Business Intelligence / Market Research.
Strong presentation skill and ability to influence others
Strong Ppt skills → Able to present to leaders frequently
Strong stakeholder management skill -> both within VN and with the region
Experience in Data extraction, manipulation and visualization
Ability to use data to create meaningful insights for the team to execute on
Ability to zoom in and out of problems
Macro view and understand industry trends
Understand the operational nuances to work closely with the verticals to make the idea a reality → Need to be hands on
Business planning & Strategic projects:
Experience in business analysis and corporate planning
Ability to drive complex projects end to end
High level of adaptability in working in a high-pressure working environment
Dependable and reliable with timely follow-up
Attention to details and strong business acumen
Results and detail-oriented, with strong intuitions on how to solve problems creatively and quickly
Quick to think on their feet and formulate their POV on ideas to steer the conversation with Grab Leadership
Team mentoring:
Work with the S&P team to grow the reach and scope of the team
Foster relationships with product, operations, and finance teams across the region to create a collaborative environment in the true GrabWay.",https://vn.linkedin.com/jobs/view/senior-manager-strategy-and-planning-at-grab-2773765865?refId=7ygMmKb6vAOSeRlvf5g7vg%3D%3D&trackingId=mEyaFrNyY0hVvyKnTkKpAg%3D%3D&position=8&pageNum=3&trk=public_jobs_jserp-result_search-card
65,"About the job
This job is sourced from a job board. Learn more
JOB DESCRIPTION Key Role and Responsibilities
Manage the preparation of reports for Risk Division to assist with the management of Credit Risk, Operational Risk,Compliance, Fraud and Collections (NPLs, Loan Impairment Expense and prudent provisioning)
Manage the design, development and maintenance of credit scorecards using internal data and external ‘Big Data’.
Manage the design, development, testing and evaluation of big data and machine learning solutions within the organizationthrough algorithms and tools.
Manage a team to design, develop and evaluate Machine Learning Pipelines solutions embracing the latest open source andcloud technologies like Python, R, AWS, …
Manage the preparation of budgets and reports on costs and expenses within Risk when required by Finance Division –provide leadership in prudently managing the approved departmental budget.
Working under instruction from the CRO you will manage credit risk forecasting, PD, LGD etc.
Be responsible for operational and statistical reports to primarily the Risk Department but will also support otherdepartments.
Manage the maintenance of internal file review process.
Manage the maintenance of old records system and transfer of files to Data Warehouse.
Oversee the high-quality maintenance of data within the company’s systems by Risk Division staff.
Oversee the extraction of PD, LGD data and maintenance of this data.
Manage internal reporting of 3rd Party agencies.
Ensure direct reports are managing efficient business operations that will aim to deliver best Risk Management practices,drive improvement in performance and develop team members.
Participate in the designing and implementation of training to help raise skill and knowledge levels of team members.
Immediately report instances of dishonesty or suspicious behavior, irrespective of the circumstances or individuals involved.
Comply with all operational risk duties as specified in the company’s policies and guidelines.
Knowledge of financial industry trends and best practice is desirable.
Provide feedback and input to any proposed changes to Risk policies where sought.
Strong skills in Excel required and knowledge of SQL is desirable.
Support change management projects and drive continuous improvement.
This role reports to the Chief Risk ",https://vn.linkedin.com/jobs/view/manager-head-data-analytics-business-intelligence-credit-risk-management-at-movi-vi%E1%BB%87t-nam-2784098488?refId=7ygMmKb6vAOSeRlvf5g7vg%3D%3D&trackingId=P%2FgYJs2oprBJdqRRll1B%2FQ%3D%3D&position=9&pageNum=3&trk=public_jobs_jserp-result_search-card
66,"About the job
We are looking for world class scientists and engineers to join our AI & Optimization group. This group is entrusted with developing optimization techniques, core data mining and machine learning algorithms for resource management solutions.

As a Data Scientist, you will use machine learning, data mining and statistical techniques to design innovative models for predictive and prescriptive analytics. You will create and refine scalable, efficient, automated processes for large scale data analyses and implement novel machine learning algorithms and statistical approaches.

Requirements
Formulate and apply machine learning, data mining and statistical techniques to design innovative models for predictive and prescriptive analytics
Supporting client engagement work in a variety of industries, areas and specialisms
Assisting in the scoping and delivery of analytical projects
Perform project tasks independently, and may direct the efforts of others
Participate in and/or lead the development of deliverable content that meets the needs of the client and contract
Contributes to new business proposals and proposal development
Develop predictive models using multiple statistical technique
Present and communicate results to clients
Provide support and assistance for the implementation of predictive model

Qualifications:
Master’s or PhD in a quantitative field such as Operations Research, Statistics, Industrial Engineering or Applied Mathematics.
Proven experience in applying machine learning techniques or related algorithm
Familiar with data mining tools, such as R and Python
Experience in healthcare sector related data mining project is preferred
Experience in handling large and complex datasets using statistical programming languages (R and Python) is essential
Good knowledge of or exposure to machine learning, data visualisation, and artificial intelligence techniques (clustering, regression, classification, etc.)
Experience with R, Python, SQL, Java or other languages
Excellent numerical aptitude, with evidence of applied problem solving
Experience in applying machine learning / data mining techniques
Ability to deliver comprehensive and detailed analytical reports
Clear and articulate communication style
Ability to collaborate and share initiatives in developing market leading, innovative analytics

Benefits
Hands-on exposure in driving solution design
Opportunity to work with our exciting, cutting-edge flagship product WorkforceOptimizer",https://vn.linkedin.com/jobs/view/data-scientist-at-workforce-optimizer-ai-enabled-wfm-2778503891?refId=7ygMmKb6vAOSeRlvf5g7vg%3D%3D&trackingId=RO9ISpHKWKrZ1yAw%2FbBsVQ%3D%3D&position=10&pageNum=3&trk=public_jobs_jserp-result_search-card
67,"About the job
Role Description

IT Business Intelligence collects and analyzes information to formulate the scope and objectives of technology solutions. Prepare and maintain technical documentation including requirements document, process flow, procedures and reporting to assist with the ongoing operation and maintenance of data management projects.

Responsibilities
Partner with Finance subject matter experts to determine detailed Finance requirements
Identify opportunities for process and control improvements
Work with Operations to identify inconsistencies between Finance and Operations requirements
Work with Technology to conduct gap analyses between Finance requirements and the existing SAP platform
Resolve all inconsistencies and document agreed upon end-to-end requirements and processes
Support the adoption of those requirements and processes within an agile development framework
Define test cases, support test execution and validate output
Analyzes business needs to determine technical requirements and identifies impacted areas/systems/processes and evaluates alternative solutions
Prepare technical documentation and deliverables including flow charts, models, and procedures, user guides and reporting.

Domain Expertise
Retail, Housing, Supply Chain or Financial Services
Familiar with Master Data Domains in one or more of the following data domains (e.g., Vendor, Chart of Accounts, Ledger, Business Partners) a plus
Familiar with SAP/ERP system a plus

Key Skills
Experience working in consulting and/or financial services
Proven Business analysis skill set with minimum 3+ years of working experience in the same role: requirement definition, business process mapping, problem solving, data analysis
Experience working within an agile development lifecycle

Analytics Experience
Interview, assess and analyze business needs
Translate business needs into technical requirements
Identifies impacted areas/systems/processes and evaluates alternative solutions

Individual Skills
Excellent communication, presentation (both oral and written) & influencing skills
Proactive problem solver, eye for detail, process driven
Familiar with Agile methodology
Good understanding of data management - data lineage, meta data, data quality, data governance, master data management
Proven ability to drive decisions and execute outcome",https://vn.linkedin.com/jobs/view/senior-business-intelligence-banking-finance-at-one-mount-2755938749?refId=7ygMmKb6vAOSeRlvf5g7vg%3D%3D&trackingId=RgAuiPo1LGFBb53T8%2ByWfw%3D%3D&position=11&pageNum=3&trk=public_jobs_jserp-result_search-card
68,"About the job
Job Description:

Get to know the team

The Business Process Automation team is a longstanding team responsible for coding automation solutions for all countries and verticals across Grab Operations. We make an impact by reducing manual work, increasing connectivity between systems and making bespoke scripts to drive value across the Org. Our team is made up of a diverse team of data analysts, full stack engineers, problem solvers and innovators. If you are looking for exciting challenges, organizational wide impact and to be part of a high-performing team then we’re the right place for you!

Get to know the role

We are looking for a new Senior Analyst for one of our Data Processing Teams. We believe a successful candidate has advanced problem solving and python programming skills, but if you believe you have what it takes then we’d love to hear from you either way. This role is required as we expand the team and continue to take on new opportunities. You will get to innovate, automate and help solve pressing problems across the organization. This role embraces your hard and soft skills to create automation tools for manual processes. Your work will have a huge impact on business operations by improving the performance and SLA of processes.

The Day-to-Day Activities

You need to work closely with business users to learn the business process, after which you will design a solution to automate that process after standardizing and optimizing it from end to end. This will require following:
Meeting with business users to gather and document requirements.
Propose design optimizations to ensure better solution design
Study the process and write query to extract data from database
Design solution and build database for automation
Write Python scripts for processing, analyzing data, connecting with other services via API.
Responsible for optimizing and maintaining automation scripts.
Build internal modules/packages on Python for internal use.
Assist other team members to optimize and bugfix.
Other related duties as required by Team Lead.
The Must-Haves
Strong understanding of data analytics, data processing and scripting.
Long Experience working with Python, R, MySQL, and other SQL languages.
Proficiency with Git a plus
Communication, interpersonal and stakeholder management skills.
English will be required to communicate effectively with stakeholders.
Work Experience Requirements

4+ years experience in data analytics, software development or process optimization roles.

Key Attributes / Skill Sets
Knowledge of and experience working with scripting languages such as Python, R, MySQL
Communication and organizational skills
Detail oriented and thorough.
Keen and prudent judgment and decision making.
Experience collaborating with non-technical teams (e.g. Operations teams, Sales, etc.).
Ability to analyze data to assess trends and issues impacting performance.
Knowledgeable with office computing tools Microsoft ",https://vn.linkedin.com/jobs/view/data-processing-senior-analyst-at-grab-2775912411?refId=7ygMmKb6vAOSeRlvf5g7vg%3D%3D&trackingId=NkcL%2FEWbusFnby%2F8aSSkJQ%3D%3D&position=12&pageNum=3&trk=public_jobs_jserp-result_search-card
69,"About the job
We are an AI Fintech company specialized in assessing credit profiles of consumers in emerging markets combining pioneering AI with large alternative data sources. In 2020 we reached our ambitious milestone of credit profiling 1bn consumers spanning 4 countries - Vietnam, Indonesia, India & the Philippines - and building a platform for the wider industry and the financial services industry in particular to provide the 'un & under' served access to credit. At the core of this initiative has been our strict and unwavering adherence to the norms of consumer data privacy and consumer data rights.
But we're not satisfied as we embark on the next leg of our journey to deliver 100 million credit lines to consumers in the markets where we operate. Although this goal is ambitious, we truly believe that by harnessing the power of AI & Big Data we can deliver financial access at unprecedented scale.
As a firm, we're audacious problem solvers motivated by our impact on society. We deeply espouse the values of ownership - of our actions and initiatives, integrity in all we do and agility in execution.
We place great importance on doing what is right, what is best and what is innovative. And we are seeking people to champion these values and beliefs as we grow. We are looking for 02 exeptional Digital Product Analytics Associates to join the Products team. If you are smart, driven and want to make a difference in the world with the most advance and fascinating technology, come join our team. We can satisfy your desire to explore new territory and give you the runway to really make an impact. 

How you will you make an impact in this role
We are partnering with banks which are embracing changes toward digital banking. These changes are exciting but complex, and we are looking for team members who are motivated by big challenges and are ready to dive headlong into helping us grapple with complexity, build solutions and turn our visions into a reality. Join us, if you have the talent and desire to deliver financial access for all by advancing data science and technology.
As a Digital Product Analytics Associate at Trusting Social, you will contribute to the Product team and will play a key role in defining our product roadmap, authoring features and user stories, and supporting prioritization and overall product development.
The Product Analyst will report and assist the Director of Product.

What you will do
Assist the Product Managers with authoring and defining features and user stories Interface with Engineering/Tech team to drive the evolution of product capabilities and system integration to support product features/experience
Collaborate closely with Data Scientists and Product Managers to build up product roadmap with insights from data.
Team up with Data Scientists and Data Engineers to ensure smooth and proper Production Implementation.
Support the strategy, roadmap, development, and launch for a product.
Advise clients with tailored use cases based on data and testing outcomes.
Provide expert's opinion for enhancement/ improvement of product suit provided to clients.
Manage Risk & Rewards for Digital Onboarding Platform with focus on optimization for a win-win deal.
Support product & process design with key stakeholders and cross-functional partners across the organization to account for requirements from credit & fraud risk, compliance, regulatory & legal
Manage data collection for product's performance tracking and improvement.
Interface with other teams to meet customer engagement objectives

What you need to have 
Good interpersonal skills.
Teamwork and hard-working with enthusiastic attitudes.
Learning ability and strong self-motivation to capture new knowledge.
Capability to zoom in and out a problem.
Effective problem-solving skills under pressure.
Experiences with common data analyst toolkits, such as R, Python, SQL, in practical.
What you will get
Work and learn from one of the best and brightest technology teams in Vietnam
Be part of a winning team with exponential growth regionally, experience recruiting world-class talents
Work directly with top-level managers and learn from the international group of experts
Top market rate pay
Generous benefits: health insurance package for family, Free Food at the office - All Day, Grab for work allowance

Additional Info
Learn more about us here:
https://www.youtube.com/watch?v=inAEDGvOcL8&t=29s",https://vn.linkedin.com/jobs/view/product-analytics-associate-digital-bank-fintech-hcmc-at-trusting-social-2716560071?refId=7ygMmKb6vAOSeRlvf5g7vg%3D%3D&trackingId=ng8o84t813u4oFo%2BUyI2tg%3D%3D&position=13&pageNum=3&trk=public_jobs_jserp-result_search-card
70,"About the job
This job is sourced from a job board. Learn more
Reporting to the Manager, Data Analytics Centre of Excellence you will be responsible for:

Collaborate with internal business users to identify their problems and provide analytical solutions. Complete data specifications, develop predictive and descriptive analytical solutions to improve business performance.

Working with external partnerships to achieve the goals of data pilot programmes.

Understand the Data & Analytics As A Service product vision, strategy and roadmap, and the associated product performance, financial and operational metrics to measure the health and success of products and initiatives.

Collaborate closely with Sales and Marketing teams to develop and manage project plan to optimize digital marketing funnel, improve user onboarding experience and develop user growth strategies for data products

Collaborate with Data and Engineering team to develop and manage project plan to deliver product features in accordance to business values

Facilitate discussions with cross-functional teams to ensure that issues and roadblocks are resolved timely by Person-In-Charge

Manage budget and expenses related to the delivery of SaaS product

In order to succeed in the role, you should ideally have:

Have at least one year of experience as Product Owner

Have a hands-on attitude - the Product Owner must be willing and able to ""dive deep"" into the inner works of our platform

You are good at working with cross-functional teams

You have solid experience leading agile teams with Kanban or Scrum methodologies

You are willing to take actions, challenge status quo and thrive in a fast-paced and dynamic environment

You are comfortable with ambiguity and able to balance priorities

You have a curious growth mindset paired with strong execution

Fluent in both written and spoken Vietnamese and English",https://vn.linkedin.com/jobs/view/business-intelligence-analyst-at-onpoint-2741659469?refId=7ygMmKb6vAOSeRlvf5g7vg%3D%3D&trackingId=DRVoUpfKK2XdhWw%2FqrL%2Ftw%3D%3D&position=14&pageNum=3&trk=public_jobs_jserp-result_search-card
